{
  "$schema": "http://json-schema.org/draft-07/schema#",
  "$id": "https://clawrocket.dev/contracts/editorial-room/v0/persona.schema.json",
  "title": "PersonaCompiledTruth",
  "description": "Constructed audience target. See EDITORIAL_ROOM_CONTRACT.md §3.5 and SCHEMA_DEFINITION.md for canonical detailed_profile spec.",
  "type": "object",
  "additionalProperties": false,
  "required": [
    "schema_version",
    "name",
    "detailed_profile",
    "cared_about_criteria",
    "triggers_to_close",
    "triggers_to_share",
    "trust_signals",
    "voice_calibration",
    "archetype",
    "game_type_preference"
  ],
  "properties": {
    "schema_version": { "const": "0" },
    "name": {
      "type": "string",
      "minLength": 1,
      "description": "e.g., 'Ankit — solo indie dev'."
    },
    "detailed_profile": {
      "type": "string",
      "minLength": 1,
      "maxLength": 4096,
      "description": "150–300 words, second-person, behavioral. THIS is the binding SSR contract — only persona field SSR generation injects into the LLM prompt. §7 cap: 4 KB."
    },
    "cared_about_criteria": {
      "type": "array",
      "items": { "type": "string", "minLength": 1 }
    },
    "triggers_to_close": {
      "type": "array",
      "items": { "type": "string", "minLength": 1 }
    },
    "triggers_to_share": {
      "type": "array",
      "items": { "type": "string", "minLength": 1 }
    },
    "trust_signals": {
      "type": "array",
      "items": { "type": "string", "minLength": 1 }
    },
    "voice_calibration": {
      "anyOf": [{ "type": "null" }, { "type": "string", "minLength": 1 }],
      "description": "How this persona reacts to prose style."
    },
    "archetype": {
      "anyOf": [{ "type": "null" }, { "type": "string", "minLength": 1 }],
      "description": "Optional structured metadata (e.g., 'indie-dev-anxious')."
    },
    "game_type_preference": {
      "anyOf": [{ "type": "null" }, { "type": "string", "minLength": 1 }]
    }
  }
}
